{
  "$schema": "http://json-schema.org/draft-07/schema#",
  "title": "Header i18n schema",
  "type": "object",
  "additionalProperties": false,
  "properties": {
    "myTemplates": { "type": "string" },
    "likedTemplates": { "type": "string" },
    "explore": { "type": "string" },
    "newTemplate": { "type": "string" },
    "login": { "type": "string" },
    "logout": { "type": "string" },
    "alertLogin": { "type": "string" },
    "newTemplateAria": { "type": "string" },
    "logoButton": { "type": "string" },
    "menu": { "type": "string" }
  },
  "required": [
    "myTemplates",
    "likedTemplates",
    "explore",
    "newTemplate",
    "login",
    "logout",
    "alertLogin",
    "newTemplateAria",
    "logoButton",
    "menu"
  ]
}
